StartDate,EndDate,Status,IPAddress,Progress,Duration (in seconds),Finished,RecordedDate,ResponseId,RecipientLastName,RecipientFirstName,RecipientEmail,ExternalReference,LocationLatitude,LocationLongitude,DistributionChannel,UserLanguage,Q_RecaptchaScore,Q2,Q3,Q4,Q5,Q6,Q7,Q8,Q9_1,Q9_2,Q9_3,Q9_4,Q9_5,Q10,Q11,Q12,Q13,Q14,Q14_7_TEXT,Q15,Q15_12_TEXT,Q16,Q17,Q18,Q19,Q20,Q22,Q23,Q24,Q25,Q26,Q27,Q28,Q29,Q30,Q31,Q32,Q32_4_TEXT,Q34,Q35,Q36,Q37,Q37_5_TEXT,Q38,Q39,Q40,Q40_5_TEXT,Q41,Q41_8_TEXT,Q42,Q43
Start Date,End Date,Response Type,IP Address,Progress,Duration (in seconds),Finished,Recorded Date,Response ID,Recipient Last Name,Recipient First Name,Recipient Email,External Data Reference,Location Latitude,Location Longitude,Distribution Channel,User Language,Q_RecaptchaScore,Legal First Name,Preferred First Name,Legal Last Name,DOB,Email,GNumber,Phone,Street Address Line 1,Street Address Line 2,Street Address - City,Street Address - State,Street Address - Zip,"Which degree program are you currently enrolled in?If you are currently enrolled in an Associate's program, but plan on obtaining a Bachelor's, select Associate's","How many college credits have you taken? 
Include any credits you are currently enrolled in.",In which academic year do you expect to graduate?,How you declared a major?,"What is your declared major at Mason? Check all that apply.
If your declared major is not listed here, check ""Other declared major"" and write it in. - Selected Choice","What is your declared major at Mason? Check all that apply.
If your declared major is not listed here, check ""Other declared major"" and write it in. - Other declared major; please specify: - Text","If you have not declared a major, what major are you considering? Check all that apply.
If your declared major is not listed here, check ""Other declared major"" and write it in. - Selected Choice","If you have not declared a major, what major are you considering? Check all that apply.
If your declared major is not listed here, check ""Other declared major"" and write it in. - Other - Text",Have you declared or are intending to declare a minor?,Which range best describes your current or most recent GPA?,How many Computer Science courses have you taken in college?,Which of the following activities related to computer science have you attended or currently participate in? Select all that apply.,"Have you completed a computing-related internship in the past?
An internship is a temporary work assignment (paid or unpaid) that is intended to provide practical experience for beginners in an occupation or profession.  
Computing-related internships and jobs involve coding, software engineering, information technology, artificial intelligence, data science, or some other application of computer science knowledge and skills.",What interests or excites you about a career in tech?,"Describe a time when you worked well on a team.
What was the goal of your team? What did you contribute? What role did you play on the team? What would you do differently next time?
The Sprinternship program is a series of career development workshops and a paid, three-week, mini-internship experience in January that immerses students in a career in technology.","Why do you want to participate in the Sprinternship program? 
What are your personal, academic, or professional goals for participating in the Sprinternship program?
All Break Through Tech programs aim to increase the number of underrepresented women pursuing degrees in computer science and careers in tech. 

Sprinternship fosters a safe and inclusive community that welcomes female-identifying students as well as members of other underrepresented groups in the tech industry.",Why do you want to learn in this environment and community?,"Do you know where you'll be living from January 3 - 21, 2022?
You must be living in the United States in January to participate in the Sprinternship program.","Where are you planning to live from January 3 - 21, 2022?City, State",What are the locations you would travel to for the Sprinternship?  Choose all that  apply,"Work hours are typically Monday through Friday, 9 AM to 6 PM. You will not be able to hold another job during these work hours from January 3 - 21, 2022.
If you accept a Sprinternship, please acknowledge you are available during these hours.",Is the accessibility of public transportation necessary for you to participate in an in-person Sprinternship?,"Do you have a government-issued ID that is valid through February 2022? Government IDs include driver's licenses and passports. University IDs are not accepted as government IDs
Your answer will not impact your Sprinternship application","What is your citizenship or residency status in the US?
Your answers to the following questions will not impact your Sprinternship application. - Selected Choice","What is your citizenship or residency status in the US?
Your answers to the following questions will not impact your Sprinternship application. - Other - Text","Do you need to borrow a laptop during the Sprinternship program?
You will need a computer to participate in all of the Sprinternship workshops. Depending on the organization you work for, you might also need a computer during your Sprinternship. We do not recommend sharing a device or using Chromebooks or tablets.","Would you have access to the internet during the Sprinternship program?
Your internet should be able to support video conferencing for several hours a day.","Is there anything else you would like to share?
This is a good space to tell us more about how youâ€™ve felt underrepresented in your experience in the tech sector, or highlight any skills or experiences that might be relevant to your participation in our program.",How did you hear about Break Through Tech and the Sprinternship program? Select all that apply. - Selected Choice,How did you hear about Break Through Tech and the Sprinternship program? Select all that apply. - Other - Text,"Type your full name below to confirm that you meet all of the eligibility requirements for the Sprinternship program. 
  
Eligibility Requirements:

 


	Undergraduate, degree-seeking student at GMU (including students currently on the NOVA Advance pathways) 
	Enrolled in at least 1 course at GMU/NOVA during the Fall 2021 semester
	First Year / Freshman, Second Year / Sophomore, or Junior
	Good academic standing (2.0+ GPA)
	Completed (received a grade of C or better) any one of the following courses:
	
		At GMU: CS 112, CS 211, IT 106, IT 206, IT 109, or IT 209
		
			Transferred credit for any of the above courses at GMU will be considered.
		
		
		At NOVA: CSC 201, CSC 222, CSC 202, or CSC 223
	
	
	18+ years of age by November 1, 2021
	Interested in pursuing a career in tech Living in the United States in January 2022
	Identify as a woman, non-binary, or gender-fluid in tech","Type your full name below to agree that you will be available for and participate in all Sprinternship program commitments.
Participation in the Sprinternship program includes four workshops during the Fall 2021 semester, full-time employment (Monday - Friday, 9AM - 6PM) from January 3 - 21, one workshop during the Spring 2022 semester, and the Sprinternship Celebration in February. 
Appropriate accommodations are available to students with religious and other personal obligations. 
September 24 - Career Prep Workshop Part 1October 1 - Career Prep Workshop Part 2October 8 - Application closesOctober 22 - Technical Skills WorkshopOctober 27 - Match EventNovember TBD - Student Onboarding with CompanyDecember 5 or 6 - WorkshopJanuary 3 - 21
Sprinternship January 29 - Post-Sprinternship Student MeetingFebruary 11
Sprinternship Celebration",Gender - Selected Choice,Gender - Prefer to self-describe; please specify: - Text,Race/Ethnicity - Selected Choice,Race/Ethnicity - Prefer to self-describe; please specify: - Text,First-Generation,Pell Grant Eligible
"{""ImportId"":""startDate"",""timeZone"":""America/Denver""}","{""ImportId"":""endDate"",""timeZone"":""America/Denver""}","{""ImportId"":""status""}","{""ImportId"":""ipAddress""}","{""ImportId"":""progress""}","{""ImportId"":""duration""}","{""ImportId"":""finished""}","{""ImportId"":""recordedDate"",""timeZone"":""America/Denver""}","{""ImportId"":""_recordId""}","{""ImportId"":""recipientLastName""}","{""ImportId"":""recipientFirstName""}","{""ImportId"":""recipientEmail""}","{""ImportId"":""externalDataReference""}","{""ImportId"":""locationLatitude""}","{""ImportId"":""locationLongitude""}","{""ImportId"":""distributionChannel""}","{""ImportId"":""userLanguage""}","{""ImportId"":""Q_RecaptchaScore""}","{""ImportId"":""QID2_TEXT""}","{""ImportId"":""QID56_TEXT""}","{""ImportId"":""QID3_TEXT""}","{""ImportId"":""QID7_TEXT""}","{""ImportId"":""QID4_TEXT""}","{""ImportId"":""QID139_TEXT""}","{""ImportId"":""QID5_TEXT""}","{""ImportId"":""QID88_1""}","{""ImportId"":""QID88_2""}","{""ImportId"":""QID88_3""}","{""ImportId"":""QID88_4""}","{""ImportId"":""QID88_5""}","{""ImportId"":""QID109""}","{""ImportId"":""QID98""}","{""ImportId"":""QID35""}","{""ImportId"":""QID111""}","{""ImportId"":""QID97""}","{""ImportId"":""QID97_7_TEXT""}","{""ImportId"":""QID112""}","{""ImportId"":""QID112_12_TEXT""}","{""ImportId"":""QID99""}","{""ImportId"":""QID113""}","{""ImportId"":""QID116""}","{""ImportId"":""QID117""}","{""ImportId"":""QID118""}","{""ImportId"":""QID120_TEXT""}","{""ImportId"":""QID121_TEXT""}","{""ImportId"":""QID122_TEXT""}","{""ImportId"":""QID123_TEXT""}","{""ImportId"":""QID124""}","{""ImportId"":""QID125_TEXT""}","{""ImportId"":""QID126""}","{""ImportId"":""QID136""}","{""ImportId"":""QID137""}","{""ImportId"":""QID138""}","{""ImportId"":""QID127""}","{""ImportId"":""QID127_4_TEXT""}","{""ImportId"":""QID129""}","{""ImportId"":""QID130""}","{""ImportId"":""QID131_TEXT""}","{""ImportId"":""QID132""}","{""ImportId"":""QID132_5_TEXT""}","{""ImportId"":""QID133_TEXT""}","{""ImportId"":""QID134_TEXT""}","{""ImportId"":""QID33""}","{""ImportId"":""QID33_4_TEXT""}","{""ImportId"":""QID60""}","{""ImportId"":""QID60_3_TEXT""}","{""ImportId"":""QID58""}","{""ImportId"":""QID59""}"
2021-08-30 15:53:54,2021-08-30 16:35:18,IP Address,68.100.9.56,100,2483,True,2021-08-30 16:35:18,R_3dM7cSvijedolzn,,,,,38.82080078125,-77.456298828125,anonymous,EN,1,Neha,Neha,Acharya,01/27/2002,nehaacharyaa90@gmail.com,G01246489,571-201-9746,6021 Creekstone Ln,,Centreville,VA,20120,Bachelor's,46-60 credits,2024-25 (Fall 2024 - Summer 2025),Yes,Information Technology,,,,No,3.700 to 4.00,0,"Student Organization,Campus Event",No,"Something in particular that excites me about a career in tech is the ability to learn and adapt as technology continues to undergo changes. I believe a career in tech is truly fruitful because I can learn something new everyday and apply my knowledge to various other fields. As someone who as always enjoyed trying out new technology, I am excited to be working in a field where I handle technology on a day to day basis.","During my time in Distributive Clubs of America(DECA), an international business/marketing club, my team and I had to come up with a business proposal. Our goal was to revive a shoe line for the Nike company that was decreasing in popularity and sales. My contributions consisted of collecting research on the past trends of the shoe such as sales, social media reposts, etc. I had to manage data sheets on Microsoft Excel and create graphs/charts to display our data. Additionally, I was in charge of taking meeting notes while we hosted team meetings to make sure everyone was on track. My role in our team was more of a back-end role where I dealt with logistics, data, and content managing. Something I would do different next time is increasing communication between our group. At times I felt like some group members were lacking communication when they were stuck on something or weren't sure of the next steps. Even I was guilty, at times, of not communicating certain issues with my group. I believe excellent communication between members is something that any team-based group can consider to be of great value. ","I want to participate in the Sprintership program because I want to gain a better understanding of what an internship in my career field would be like before I launch myself into a full fledge internship. One of my academic goals for the summer of 2022 is to secure an internship so I can practice my skills and gain real-world knowledge. I believe the Sprintership program will prepare me for an internship in tech in the near future. I have never actually been able to apply the skills I have learned in the classroom to a real industry or project, which is something I am hoping to do through this program. ","I want to learn in this environment because I appreciate how there are different stages, and even prep stages prior to the actual internship. I like how there are opportunities to improve my resume, engage with industry professionals, and interact with other like-minded individuals. I feel a sense of comfort knowing that I will be immersed into a motivated and inclusive community of individuals. ",Yes,"Centreville,VA","Washington, DC,Virginia - Arlington and Fairfax Counties,Virginia - Stafford, Spotsylvania and Prince William Counties,Virginia - Loudon and Faquier Counties","I understand the time commitment of participating in a Sprinternship. If accepted into the program, I will not enroll if I am unable to fully participate.",No,Yes,US Citizen,,No,Yes,"At George Mason University, I am apart of Girls Who Code and Society of Women Engineers. Both of these clubs aim to empower women in STEM and provide opportunities for those who are underrepresented in the tech field. I am excited to potentially share what I have learned through workshops in these clubs and bring my knowledge to the Sprintership. ",Break Through Tech,,Neha Acharya,Neha Acharya,,,,,,
2021-09-08 13:13:41,2021-09-08 13:50:02,IP Address,192.5.215.208,100,2181,True,2021-09-08 13:50:02,R_50cwBVKbg0R2UbD,,,,,38.84759521484375,-77.32810211181640625,anonymous,EN,1,Neil,Neil,Cruz,11/12/2001,neilcruz2k1@gmail.com,G01248143,5713579010,2914 Kings Chapel Road,APT #6,Falls Church,Virginia,22042,Bachelor's,31-45 credits,2024-25 (Fall 2024 - Summer 2025),Yes,Computer Science,,,,No,3.700 to 4.00,3,Campus Event,Yes,"Computers and technology as a collective whole as well as how they work to the at computational level intrigue me to learn so much more about them and also inspire me to learn and acquire beneficial skills which can potentially help others when problem solving in the future. ","When I was working with a group of team members for a small organization involving software and front-end development, our goal was to implement a strategy for SEO onto a website and also modify certain front-end aspects of the website itself. 

My role was as a voluntary engineer was to work with 4 other people just like me in which we collaborated together to come up with the plan. Because we were on a deadline, we had constantly kept each other up to date with how our schedules would work in order to arrange days where we could collaborate. Whenever we encountered problems within our group, we always devised a way to figure out solutions that we can tackle one by one and arrange the role of each person from there. If we could not work efficiently through it, we would ask our supervisor for guidance, which would help us tremendously, and we would get our work done by the deadline. 

Some things I could consider that I could do next time is to propose much more solutions to how we could get our work done efficiently, but I am somebody who is willing to work and cooperate with any person regardless of what they are capable and not capable of because I believe everybody is a great team player and worker if they are putting in their best effort overall. Because my team and I were inexperienced engineers, this allowed us to get a grasp of collaboration and teamwork when it came to the tech work. ","I am interested in participating in the Sprintership program because I have an exciting urge to work with people in the tech industry. My passion for technology and computers allows me to seek and learn more about all sorts of technology that is evolving in our industry and I also try to learn even more skills related to this field outside of school during my free time. ","I believe this environment and community will give me the best experience in a manner of time that adjusts with my schedule. I love working with all people and would like the opportunity to work with others in this program. ",Yes,"Falls Church, VA","Washington, DC,Virginia - Arlington and Fairfax Counties","I understand the time commitment of participating in a Sprinternship. If accepted into the program, I will not enroll if I am unable to fully participate.",Yes,Yes,US Citizen,,No,Yes,*** THE SUBMISSION LINK FOR THE RESUME AND TRANSCRIPT DOES NOT WORK ***,"Break Through Tech,Professor,Other",,Neil Justine Frane Cruz,Neil Justine Frane Cruz,,,,,,
2021-09-08 12:57:30,2021-09-08 20:04:10,IP Address,173.79.158.189,100,25599,True,2021-09-08 20:04:11,R_1Lzn1b1GwMWo5hc,,,,,38.8878936767578125,-77.44480133056640625,anonymous,EN,0.89999997615814208984375,Hannah,Hannah,Hong,01/03/2000,hhhong3197@gmail.com,G01148218,5713538555,9100 Hunting Pines Pl,,Fairfax,VA,22032,Bachelor's,61-75 credits,2022-23 (Fall 2022 - Summer 2023),Yes,Computer Science,,,,Not sure,3.00 to 3.69,5+,"Competition (hackathon, robotics),Campus Event,Industry-hosted meetup or event",No,There is so much creative freedom in tech that is both practical and sophisticated. I look forward to learning more and honing my abilities so that I can further create beautiful technology.,"I am currently taking CS 321 and it requires for a semester long group project with the goal of creating a system that has a unique aspect. On this team I was elected to be the group leader as I took initiative with team meetings, brainstorming, TA meetings, and when our project idea was denied by the professor, I was able to pitch our idea with more detail and persuaded her to ultimately approve the idea.","Through this program, I hope to collaborate with my peers in a safe space and glean knowledge and skills from both mentors and fellow Sprinters. There is always more knowledge to learn and people to meet for me to grow my career as well as myself. I have made it a personal goal for myself this year to not sway to my introverted tendencies and get to know as many people on a meaningful level and I hope to achieve that through this program as well.","Everyone in this community will have had similar day to day experiences in the workplace or classroom especially in this industry, and that communal understanding alone makes this environment feel that much safer and respectful. I hope to work alongside and compete with my peers in this safe space, encouraging each other with the knowledge that we are not alone.",Yes,"Fairfax, VA","Washington, DC,Virginia - Arlington and Fairfax Counties,Virginia - Loudon and Faquier Counties","I understand the time commitment of participating in a Sprinternship. If accepted into the program, I will not enroll if I am unable to fully participate.",No,Yes,US Citizen,,No,Yes,"Women have always been a minority in the tech industry and while I have not let it bother me too much, with each additional CS class I take, the number of women decreases. I hope to see many women in my field both in school as well as professionals supporting each other. I would also like to add that my application will not have the resume or unofficial transcript attached due to the malfunction of the link that was given. Please send further instructions on where to send the email to hhhong3197@gmail.com. ","Break Through Tech,Other",email through school,Hannah Hong,Hannah Hong,,,,,,
2021-09-08 13:24:54,2021-09-09 15:11:20,IP Address,129.174.182.32,100,92785,True,2021-09-09 15:11:20,R_1hKBZclDW0luA1q,,,,,38.84759521484375,-77.32810211181640625,anonymous,EN,0.89999997615814208984375,Sarah,Sarah,Rashad,02/18/2002,rashadsarah18@gmail.com,G01260740,5713146168,9207 Stephanie St.,,Manassas Park,Virginia,20111,Bachelor's,16-30 credits,2023-24 (Fall 2023 - Summer 2024),Yes,Information Technology,,,,Yes,3.700 to 4.00,3,"Competition (hackathon, robotics),Student Organization,Campus Event",Yes,"New technology, working with team to build/create new things, improving humans quality of life, Internet of Things, seeing and/or editing the backhand of products","A time I worked well on a team was in my INOVA technical internship when I was on the Patient Financial Service team. The goal of my team was to take care of the patient's batches, update and edit them. The role I played was to update and checking the verification of them and I believe I worked well because I was responsible in terms of turning in things on time, communicating effectively with my team, and working efficiently. ","I really want to participate in the Sprinternship program because I believe that it will greatly benefit me in all the desired skills, experience, and knowledge for my future career. My personal, academic, and professional goals is to, of course, enhance more technical skills and knowledge, networking with women in tech (due to women's less exposure in tech I have less connections), work on a team and increase teamworking skills in a professional setting.",I want to learn in this environment and community because I feel like it will be much more welcoming and warm into the tech field at Mason because I have been overwhelmed and I haven't felt that close connection yet. I want to be able to meet other women who have similar interests and career goals as me. I feel I will want to learn more because of the welcoming and accepting environment and community. It will feel as if my hand is being more held with everyone and I am not alone.,Yes,"Manassas Park, VA","Virginia - Arlington and Fairfax Counties,Virginia - Stafford, Spotsylvania and Prince William Counties,Virginia - Loudon and Faquier Counties","I understand the time commitment of participating in a Sprinternship. If accepted into the program, I will not enroll if I am unable to fully participate.",No,Yes,US Citizen,,No,Yes,"I have felt underrepresent in my experience in the tech sector as a women in many of my classes there aren't much females so I feel less welcomed. When I was in highschool, I really wanted to join the Girl's Who Code program however, I never was able to and I always wanted to do a program/internship experience in the tech-related field with women to feel the empowerment and familiarity especially entering a challenging field.","Break Through Tech,Professor,Friend",,Sarah Rashad,Sarah Rashad,,,,,,
2021-09-10 13:36:01,2021-09-10 13:54:38,IP Address,100.36.193.206,100,1116,True,2021-09-10 13:54:39,R_tVYLCxZmJqngFIR,,,,,38.643798828125,-77.34510040283203125,anonymous,EN,0.89999997615814208984375,Evelyn,Evelyn,Cortez,10/19/1999,lincortez323@gmail.com,G01324247,571-277-6794,15245 crescent st,,Woodbridge,VA,22193,Bachelor's,31-45 credits,2023-24 (Fall 2023 - Summer 2024),Yes,Computer Science,,,,Not sure,2.30 to 2.99,5+,Break Through Tech Summer Guild,No,What excites me about a career in tech is being able to implement my skills to real world situations.,"The time when I worked well on a team was during the GUILD program. We had to brainstorm ideas and in the end we used certain aspects of each Idea and implemented it in our final prototype. Me and my team members felt very accomplished because although we had little time to complete the prototype we were able to finish it on time. Since I had more experience with coding, I was able to finish my part of the prototype first, and I was able to help my team members with their code. ","I want to participate in the Sprinternship program because not only will it help me build up my resume, it will also give me an Idea of what I can expect in a real world environment. ","I want to learn how to lead a team and be more vocal with the ideas that I have. ",Yes,"woodbridge, VA","Virginia - Arlington and Fairfax Counties,Virginia - Stafford, Spotsylvania and Prince William Counties","I understand the time commitment of participating in a Sprinternship. If accepted into the program, I will not enroll if I am unable to fully participate.",Yes,Yes,US Citizen,,No,Yes,,"Break Through Tech,Peer Mentor,Other",From the GUILD summer program,Evelyn Cortez,Evelyn Cortez,,,,,,
