StartDate,EndDate,Status,IPAddress,Progress,Duration (in seconds),Finished,RecordedDate,ResponseId,RecipientLastName,RecipientFirstName,RecipientEmail,ExternalReference,LocationLatitude,LocationLongitude,DistributionChannel,UserLanguage,Q_RecaptchaScore,Q2,Q3,Q4,Q5,Q6,Q7,Q8,Q9_1,Q9_2,Q9_3,Q9_4,Q9_5,Q10,Q11,Q12,Q13,Q14,Q14_7_TEXT,Q15,Q15_12_TEXT,Q16,Q17,Q18,Q19,Q20,Q22,Q23,Q24,Q25,Q26,Q27,Q28,Q29,Q30,Q31,Q32,Q32_4_TEXT,Q34,Q35,Q36,Q37,Q37_5_TEXT,Q38,Q39,Q40,Q40_5_TEXT,Q41,Q41_8_TEXT,Q42,Q43
2021-09-22 11:52:27,2021-09-22 12:27:34,IP Address,108.28.45.131,100,2107,True,2021-09-22 12:27:35,R_3lRg8gR8ACgywNx,,,,,38.643798828125,-77.34510040283203125,anonymous,EN,1,Phuong,,Tran,01/22/2000,ptran40@gmu.edu,G01148794,5713937482,4403 Hamilton Drive,,Woodbridge,Virginia,22193,Bachelor's,More than 90 credits,2022-23 (Fall 2022 - Summer 2023),Yes,Computer Science,,,,No,3.00 to 3.69,5+,I have not participated in any activities related to computer science before.,No,"Programming, Learning and using new technology","One time, I had to work with a team to create a working amenities booking websitein 8 weeks. I implemented a feature that allows users to find other users to play sports with. We all shared roles and took initiative to work and set up meetings. Everyone had a feature they implemented, but we communicated every day to keep each other updated in our progress. Our individual work ethics motivated each other to complete the project two weeks earlier than the deadline. I didn't know a lot about creating a website with a working database, but thanks to this experience, I learned a lot. If there's one thing I would change, it would be to implement more features. We didn't plan for too many features in fear we wouldn't deliver in time.","Personally, I am interested in working a technical environment with others who are like me. I believe it would motivate me and introduce me to the industry. Academic wise, I want to learn new things from the work place and from other participants. Professionally, I want to experience what it is like to work in the tech industry.","I believe having people who are like me will make the environment more inviting and less intimidating. I will feel more comfortable opening up and asking questions. This way, I will gain experience and confidence for when I enter the industry.",Yes,"Woodbridge, Virginia","Washington, DC,Maryland - Prince George's and Montgomery Counties,Maryland - Howard and Anne Arundel Counties,Maryland - Charles and Calvert Counties,Virginia - Arlington and Fairfax Counties,Virginia - Stafford, Spotsylvania and Prince William Counties,Virginia - Loudon and Faquier Counties","I understand the time commitment of participating in a Sprinternship. If accepted into the program, I will not enroll if I am unable to fully participate.",No,Yes,US Citizen,,No,Yes,,Break Through Tech,,Phuong Tran,Phuong Tran,,,,,,
2021-09-22 12:47:56,2021-09-22 13:15:35,IP Address,129.174.182.71,100,1658,True,2021-09-22 13:15:35,R_OwhxLujTS2ZoXYJ,,,,,38.84759521484375,-77.32810211181640625,anonymous,EN,1,Nuseiba,Nuseiba,Alharazi,09/03/2002,alharazinuseiba1@gmail.com,01227432,703-832-6997,5708 Barrymore Road,,Centreville,VA,20120,Bachelor's,61-75 credits,2023-24 (Fall 2023 - Summer 2024),Yes,Computer Science,,,,Yes,3.700 to 4.00,3,"Student Organization,Campus Event,Conference",No,"I am most excited to see the future of technology, especially in terms of AI. I am most interested in that field because it shows that we can teach the computer to act just like how we humans would. Technology is a part of every aspect of our lives and it helps make our lives not only easier, but often time safer, and I would love to see how these forms of technology are created. In my computer science courses I work on a lot of projects that seem to accomplish day-to-day simple tasks, but I want to see how a program would be implemented in a larger scale.","I am currently working as a part-time assistant teacher, and there are many occasions where we all need to work together to accomplish a task in order to ensure that the students have everything they need to succeed. A specific time that comes to mind is in the beginning of every school year we come together and discuss lesson plans as a team. Although I have worked there the shortest amount as I have worked there for 3 years and others have worked there for 4 or more, the director has made it clear that I have the qualities of a leader and has given me responsibilities to help guide the team, and the center as a whole. My role on the team is to divide up tasks to each individual and make sure everyone understands what goals they need to tackle in the upcoming months. Throughout the school year, I check in on my teammates and assist them whenever necessary. My role also requires that I interact with the families that attend my job and answer any questions or concerns they have. I am currently still taking on this role, but what I can do to improve my role as a leader is to not only teach and show the other members how to be a good teammate, but also help them improve themselves and gain qualities to become a leader in the future.","This Sprinternship would be a perfect opportunity to further my knowledge beyond what I have learned in the classroom. I have learned different programming languages and data structures, and my goal is to implement what I have learned in the real world. I also hope to take what I have learned from the program and use it in my future computer science courses. Another goal I wish to accomplish after this internship is to hopefully use the experience as a way to earn future internships throughout my college career. Many companies want their interns to have previous experience, and it is hard to find a company that will provide you that first experience. Overall, this program will allow me to grow as a computer science student.","I want to learn in this environment because I noticed that in my current Data Structures course, there is mostly males in my class. There are not many females, and it leads to us feeling more reserved and sometimes not as confident. I want to join this program because it is welcome to females and will allow me to gain that confidence and feel more comfortable, which is a perfect environment to grow. I have attended many panels consisting of women who have been successful in the tech world, and I hope to follow in their footsteps.",Yes,"Fairfax, Virginia","Washington, DC,Virginia - Arlington and Fairfax Counties","I understand the time commitment of participating in a Sprinternship. If accepted into the program, I will not enroll if I am unable to fully participate.",No,Yes,US Citizen,,No,Yes,"I hope to join this program because many people believe women are the minority in the computer science major, which may be true because there are more males, but that does not mean we can not accomplish the same or even more tasks. When I tell people that I am a computer science major, they are always shocked, and I hope to prove to them that I have the dedication and necessary qualities to be successful and make an impact. I have gained knowledge in different languages such as Python, Java, and HTML, and in the spring will be learning C. I believe I have the potential to make a great impact in the tech world, and serve as a helpful intern in this program.",Professor,,Nuseiba Alharazi,Nuseiba Alharazi,,,,,,
2021-09-10 13:56:49,2021-09-22 17:46:33,IP Address,72.205.9.142,100,1050583,True,2021-09-22 17:46:34,R_3Jhmzp5g9fDwcXv,,,,,38.875396728515625,-77.3852996826171875,anonymous,EN,0.89999997615814208984375,Nayoung,Isla,Kim,01/28/2000,nkim35@gmu.edu,"G01200437 ",8042976288,12154 Lincoln Lakeway,Apt 4312,Fairfax,Virginia,22030,Bachelor's,61-75 credits,2021-22 (Fall 2021 - Summer 2022),No,,,Other,Statistics,Yes,3.700 to 4.00,2,"Break Through Tech Summer Guild,Student Organization",No,"There are three essential elements that all humans must acquire to live in our society for thousands of years: clothes, food, and housing. During the last decade, the places to acquire those elements have changed. I saw the clothing industry shifting its primary revenue source from offline stores to e-commerce. The food industry with the delivery platforms such as Uber Eats and Doordash is growing rapidly and taking the market share aggressively. Even for a house, platforms like Zillow stepped into the e-commerce for people who live from a distance to freely explore listed houses through their phones at home. As more I learned about those changes, I became more interested in learning technology that allowed these changes to occur. These transitions made me explore how technology affects my daily life and my near future, and I would like to participate in those transitions by working in the technology industry. My current and main interests are data analysis and data mining because data contains insights into what people around the world would like and dislike. ","Last semester in my business class, our team had to make a presentation about increasing awareness of discrimination in the workplace. At first, I thought this topic was vague and broad. Through research, our team identified global trends of the matter and how companies should increase awareness. Our weekly meeting was effective because we set a schedule during our first meeting. Each member of our team had a different background, and this factor allowed us to create our presentation in-depth with more information and perspectives. ","My experience with the breakthrough program encouraged me to learn more about coding because the environment was welcoming. I did not feel the pressure of asking questions and sharing my thoughts because TAs and professors were willing to answer my questions. It helped me explore the field in-depth, and now I am planning to minor in data analysis. However, I want to acquire more skills through workshops and Sprinternship to prepare for a summer internship in 2022. ","As I mentioned earlier, having colleagues who have a similar level of knowledge in stem encourages and inspires me to expand my perspective. Also, I want to learn in this environment and community because it is an essential factor in stem workplace and women in stem. Many research papers have shown that tech companies need female perspectives for their platforms because most of them consider the male perspective as the standard. This problem is limiting their market size because female users make up about half of the population. I believe programs like Sprinternship and Breakthru are an excellent start for beginners like me because it gives me confidence in my choice as a female in the stem field. ",Yes,"Fairfax, Virginia","Washington, DC,Virginia - Arlington and Fairfax Counties","I understand the time commitment of participating in a Sprinternship. If accepted into the program, I will not enroll if I am unable to fully participate.",No,Yes,US Citizen,,No,No,,Break Through Tech,,Nayoung Kim,Nayoung Kim,,,,,,
2021-09-22 17:24:47,2021-09-22 18:00:04,IP Address,73.134.73.186,100,2116,True,2021-09-22 18:00:05,R_1DNKP8B17GmqAXY,,,,,38.643798828125,-77.34510040283203125,anonymous,EN,1,Ehtasham,Ehtasham,Sarwar,11/04/2001,esarwar@gmu.edu,01252484,7034798616,3516 Cranmer Mews,,Woodbridge,VIRGINIA,22193,Bachelor's,31-45 credits,2023-24 (Fall 2023 - Summer 2024),Yes,Computer Science,,,,Yes,3.00 to 3.69,3,Other,Yes,"I want to build software that will change peoples life for the better, that's what excites me about a career in tech.","I worked on creating an online business with my friend. My contribution to  this team of 2 was developing the marketing strategy, contacting the manufacturer for the product, and designing the UI of the website that we were going to build. I took on a lot more responsibility then my team member and for that reason my work was not of the best quality. Something that I would change next time would be to divide the work evenly among the team.",My goals for participating in the sprinternship are to gain experience of working in a team and to learn and improve on new concepts in the field of software engineering. Another goal of mine is to gain experience working in a team and to improve my communication skills.,"I want to improve my programming skills and gain experience of working in the real world of software engineering. I also want to learn to better work with the people around me and ask for help when needed. ",Yes,,,"I understand the time commitment of participating in a Sprinternship. If accepted into the program, I will not enroll if I am unable to fully participate.",No,Yes,US Citizen,,No,Yes,,Other,an email from the cs depart at my school,Ehtasham Sarwar,Ehtasham Sarwar,,,,,,
2021-09-22 18:25:46,2021-09-22 18:34:49,IP Address,50.7.93.84,100,542,True,2021-09-22 18:34:50,R_2q1Lnxk21Yc3I9u,,,,,52.386199951171875,4.7505950927734375,anonymous,EN,0.89999997615814208984375,Nayoung,Isla,Kim,01/28/2000,nkim128@gmail.com,G01200437,8042976288,12154 Lincoln Lake Way,"#4312",FAIRFAX,Virginia,22033-6210,Bachelor's,61-75 credits,2022-23 (Fall 2022 - Summer 2023),No,,,Other,Data Analysis/Information Systems and Operations Management,Yes,3.700 to 4.00,1,"Break Through Tech Summer Guild,Student Organization",No,"There are three essential elements that all humans must acquire to live in our society for thousands of years: clothes, food, and housing. During the last decade, the places to acquire those elements have changed. I saw the clothing industry shifting its primary revenue source from offline stores to e-commerce. The food industry with the delivery platforms such as Uber Eats and Doordash is growing rapidly and taking the market share aggressively. Even for a house, platforms like Zillow stepped into the e-commerce for people who live from a distance to freely explore listed houses through their phones at home. As more I learned about those changes, I became more interested in learning technology that allowed these changes to occur. These transitions made me explore how technology affects my daily life and my near future, and I would like to participate in those transitions by working in the technology industry. My current and main interests are data analysis and data mining because data contains insights into what people around the world would like and dislike. ","Last semester in my business class, our team had to make a presentation about increasing awareness of discrimination in the workplace. At first, I thought this topic was vague and broad. Through research, our team identified global trends of the matter and how companies should increase awareness. Our weekly meeting was effective because we set a schedule during our first meeting. Each member of our team had a different background, and this factor allowed us to create our presentation in-depth with more information and perspectives. ","My experience with the breakthrough program encouraged me to learn more about coding because the environment was welcoming. I did not feel the pressure of asking questions and sharing my thoughts because TAs and professors were willing to answer my questions. It helped me explore the field in-depth, and now I am planning to minor in data analysis. However, I want to acquire more skills through workshops and Sprinternship to prepare for a summer internship in 2022. ","As I mentioned earlier, having colleagues who have a similar level of knowledge in stem encourages and inspires me to expand my perspective. Also, I want to learn in this environment and community because it is an essential factor in stem workplace and women in stem. Many research papers have shown that tech companies need female perspectives for their platforms because most of them consider the male perspective as the standard. This problem is limiting their market size because female users make up about half of the population. I believe programs like Sprinternship and Breakthrough Tech program are an excellent start for beginners like me because it gives me confidence in my choice as a female in the stem field. ",Yes,"Fairfax, Virginia","Washington, DC,Virginia - Arlington and Fairfax Counties","I understand the time commitment of participating in a Sprinternship. If accepted into the program, I will not enroll if I am unable to fully participate.",No,Yes,US Citizen,,No,No,,"Break Through Tech,Professor,Peer Mentor,Friend",,Nayoung Kim,Nayoung Kim,,,,,,
2021-09-22 19:11:31,2021-09-22 19:59:22,IP Address,173.66.16.202,100,2871,True,2021-09-22 19:59:23,R_10VlsbxABMLvLto,,,,,38.84759521484375,-77.32810211181640625,anonymous,EN,1,Ramsha,Ramsha,Kapadia,09/21/2002,ramsha.kapadia@gmail.com,G01246531,703-593-4965,2605 Meadow Hall Dr,,Herndon,VA,20171,Bachelor's,46-60 credits,2023-24 (Fall 2023 - Summer 2024),Yes,Computer Science,,,,Not sure,3.700 to 4.00,4,I have not participated in any activities related to computer science before.,No,"I like the idea of building something using programming in the real world, such as a website. Additionally, I believe there is always more than one way of solving a problem, and I like the freedom that it gives me to find a creative solution that allows me to enjoy my work.","While maintaining my schoolwork, I have been attending dance class as well, where my group and I are preparing for a performance in October 2021. During one of our group practices, we had a minor disagreement about what position to hold at a certain music cue. Two of the girls wanted one step, while two others wanted another. Since the argument was going nowhere, I stepped in and presented a compromise that combined both the moves by doing both the steps, one after the other. That solved the problem and got us back on track.","I would like to gain hands-on real world experiences in the IT field. I want to try something new. Rather than completing a project on my own, I want to gain an understanding of how a real work environment will function. I also would like to enhance my programming skills. Since the tech world is always changing and evolving, learning about new advancements that are occurring today would be beneficial for both me and my career.","I look forward to meeting people with similar backgrounds as myself. Being a woman of color in STEM, it is not easy to find people who relate to my experiences. This environment would allow me to create lasting friendships while also gaining programming experience, which I believe are both vital when it comes to work.",Yes,"Herndon, VA","Washington, DC,Maryland - Baltimore City/Baltimore County,Virginia - Arlington and Fairfax Counties,Virginia - Loudon and Faquier Counties","I understand the time commitment of participating in a Sprinternship. If accepted into the program, I will not enroll if I am unable to fully participate.",No,Yes,US Citizen,,No,Yes,"As a gay woman of color in STEM, it is hard to find people who understand my experiences. That is why I really appreciate this opportunity to meet new people who struggle with the same issues as me while also advancing my programming skills and career.",Break Through Tech,,Ramsha Kapadia,Ramsha Kapadia,,,,,,
2021-09-22 20:31:47,2021-09-22 21:22:59,IP Address,108.48.21.235,100,3072,True,2021-09-22 21:23:00,R_2v2iWne9F1jmFxe,,,,,38.8574066162109375,-77.09999847412109375,anonymous,EN,1,Rohit,Rohit,Barua,05/25/2001,rbarua3@gmu.edu,G-01200381,5716999468,705 South Walter Reed Drive APT# 411-B,,Arlington,Virginia,22204,Bachelor's,61-75 credits,2022-23 (Fall 2022 - Summer 2023),Yes,Computer Science,,,,"No,Not sure",3.00 to 3.69,3,"Student Organization,Industry-hosted meetup or event",Yes,The ability to design and invent new things. Being creative and solve complex problems that we face in our world.,"In high school, our robotics team participated in a competition in order to win represent our school. I was part of the programming team and was in charge of maintaining the source code for the team. I played a semi-leadership role within the team because I had to constantly keep everyone updated/motivate and maintain a good workflow to meet deadlines. One thing I would definitely do differently is have a checklist for each individual programmer because most of them were very confused about their tasks and a checklist for each member would have been quite beneficial at that time.","I wish to pursue a career in Software Engineering and in order to reach that professional goal I need to gain a lot of experience in the CS field in order to land an actual job. By participating in this Springternship program, I hope to gain enough knowledge and skills to land an internship during the summer before my graduation year. Hopefully, by the time I graduate I will have a job at hand.",I want to meet more diverse people and learn about their experiences. I hope to learn a lot about different people and their work culture in order to apply them for myself at my future workplace(s). I believe each interaction is a learning experience whether it is good or bad because there is always a lesson to learn.,Yes,"Arlington, VA",Virginia - Arlington and Fairfax Counties,"I understand the time commitment of participating in a Sprinternship. If accepted into the program, I will not enroll if I am unable to fully participate.",Yes,Yes,US Citizen,,No,Yes,"I am decent at Python and Java. Currently I am taking CS 310, so hopefully I can put those skills at work.","Professor,Friend,Other","Piazza (CS 310), email",Rohit Barua,Rohit Barua,,,,,,
2021-09-22 22:12:43,2021-09-22 22:34:26,IP Address,100.36.145.40,100,1302,True,2021-09-22 22:34:27,R_5heJVZzf2psjVLz,,,,,38.7913055419921875,-77.28060150146484375,anonymous,EN,1,Yixuan,Chou Chou,Cheng,06/26/2002,ycheng22@gmu.edu,G01280798,804-464-5674,14806 Windjammer Drive,,Midlothian,Virginia,23112,Bachelor's,46-60 credits,2023-24 (Fall 2023 - Summer 2024),Yes,Computer Science,,,,Yes,3.700 to 4.00,3,"Student Organization,Campus Event,Other",No,"I love the fact that I am able to create things so I would like to combine my creative side with my major and make things that are both useful and exciting to me. I am also very artistic and love helping people, and because computer science is so versatile, I hope to find a career in tech where I am able to help people and also express my artistic side.","During my first ever teaching session this summer for Girls Who Codeâ€™s online Summer Immersion Program, I was very honored to be able to teach HTML, CSS, and Javascript to high school aged girls around the world with different ethnicities and identities. For the last round of the program, not only were my teaching team and I from different parts of the world, the students were also. There were students from India who loved to write HTML, students from Ireland who spoke about CSS with passion, and students from the UK who absolutely loved what you can do with Javascript. Because of our cultural differences and different upbringings, many students had lots of different ideas and perspectives from everyone else. This helped the classroom be more intriguing and interesting all while keeping the studentâ€™s attention at bay while they learned from one another. By the end of the program, not only was our classroom one of the most supportive, respective and surprisingly advanced sections of our round, but our students also learned the most.","As a woman in tech myself, and the founder of Girls Who Code College Loop here at George Mason University, my goals are aligned with All Break Through Tech programs. I want to be a woman in tech that supports women or girls in and out of tech. I want to inspire and I want to be a role model for those coming into tech and in the future. I believe that with the Sprinter ship program, I am able to know more about the technology industry, explore more about possible career paths, and learn more about how women are doing in this field. I hope that with this opportunity, I am able to enrich myself with more experience and gain more knowledge!","It is one thing to learn about thing, but it's different experiencing it first hand. In Chinese, there is a saying called talking about war on paper, which is a metaphor for someone who is only good at talking about things but never experienced much. I would love to be someone with lots of experience so I can help others like how others have helped me when I was lost. I strongly believe that this environment and community will give me the insight I need to improve my knowledge and experience.",Yes,"Fairfax, Virginia","Washington, DC,Maryland - Prince George's and Montgomery Counties,Maryland - Howard and Anne Arundel Counties,Maryland - Baltimore City/Baltimore County,Maryland - Charles and Calvert Counties,Virginia - Arlington and Fairfax Counties,Virginia - Stafford, Spotsylvania and Prince William Counties,Virginia - Loudon and Faquier Counties","I understand the time commitment of participating in a Sprinternship. If accepted into the program, I will not enroll if I am unable to fully participate.",No,Yes,Permanent Resident,,No,Yes,"As an leader, I am experienced in staying organized and have good communication skills. However, as a woman of color, I feel underrepresented even when I am just looking around the room during a class. I want to strengthen myself to prepare myself to help others.","Break Through Tech,Professor,Other",Email,Yixuan Cheng,Yixuan Cheng,,,,,,
