StartDate,EndDate,Status,IPAddress,Progress,Duration (in seconds),Finished,RecordedDate,ResponseId,RecipientLastName,RecipientFirstName,RecipientEmail,ExternalReference,LocationLatitude,LocationLongitude,DistributionChannel,UserLanguage,Q_RecaptchaScore,Q2,Q3,Q4,Q5,Q6,Q7,Q8,Q9_1,Q9_2,Q9_3,Q9_4,Q9_5,Q10,Q11,Q12,Q13,Q14,Q14_7_TEXT,Q15,Q15_12_TEXT,Q16,Q17,Q18,Q19,Q20,Q22,Q23,Q24,Q25,Q26,Q27,Q28,Q29,Q30,Q31,Q32,Q32_4_TEXT,Q34,Q35,Q36,Q37,Q37_5_TEXT,Q38,Q39,Q40,Q40_5_TEXT,Q41,Q41_8_TEXT,Q42,Q43
2021-10-04 21:16:53,2021-10-04 22:38:24,IP Address,76.78.141.69,100,4891,True,2021-10-04 22:38:25,R_23f6tU230psGeFZ,,,,,38.84759521484375,-77.32810211181640625,anonymous,EN,0.89999997615814208984375,Nasrin,Nasrin,Ali,12/29/2002,nasrinali081@gmail.com,G01308449,240-855-1921,4400 University Drive,,Fairfax,Virginia,22030,Bachelor's,16-30 credits,2024-25 (Fall 2024 - Summer 2025),Yes,Computer Science,,,,Yes,3.700 to 4.00,1,"Competition (hackathon, robotics),Student Organization,Campus Event,Conference,Other",I'm not sure,"Everything about a career in tech interests me. The field is so broad, and you can really do anything you want with it. Personally, I would like to become a software engineer. However, I also want to work with AI to develop and improve technology that will assist in accurately and efficiently diagnosing cancer. I am also interested in the intersection between AI and fashion design. I think tech is interesting because there are no limits to what you can do. The only constraints are your mind! It's a field for analytical minds, but it provides a lot of space for creatives to be involved as well. And lucky for me, I am both! Another thing that excites me about a career in tech is the opportunity to serve as a role model. I am an African American Muslim woman and I would love the opportunity to inspire other young girls who are just like me. In general, I would like to serve as a role model and an inspiration for all women who want to pursue a tech career. I want to break ceilings and push boundaries to their limits. To conclude, I am excited to pursue a career in tech because it will allow me to delve further into personal interests as well as prepare me for a tech-driven future. 
","The most recent time I worked well with a team was this past weekend at the GMU Honors College Connect Nonprofit Hackathon. about 30 of us were randomly placed into 4 teams of 5/6, and assigned a nonprofit organization to help rebrand or improve their communications. My team was assigned to work with the Starfish Foundation, an organization that provides scholarship, tutoring, and leadership development to youth living in extreme poverty in Guayaquil, Ecuador. The goal of our team was to strategically use existing or new content to tell a story reflecting the Starfish Foundation's impactful services and inspire potential supporters to be a part of their mission. I contributed ideas on content that could be created, my thoughts on how we could use existing content, and ways to engage potential volunteers or supporters. My role was to help come up with prototypes of all the ideas we came up with and to collaborate with my partners to present our final ideas to Jenn, the nonprofit owner. Some of the ideas we came up with included an interactive donation tracker/portal for donors and volunteers, a ""Walk of Change"" page on their website, scripted videos, montages of the children, social media posting schedules, physical marketing, and general advertising. Although this was a positive experience, and I worked well with my team, I would do a few things differently next time. I have a tendency to let people talk over me, and I am working on stopping that. Next time, I will make sure my voice and my ideas are clearly heard. I believe this internship would be a great opportunity to improve on that.","Participating in the Sprintenship program would be a meaningful experience because I love women in STEM, and I am excited about more girls and underrepresented genders getting involved in the field. I am a computer science major with a prospective minor in math. So far, my computer science class has been amazing, and I have met a lot of great people, but you know who I haven't met a lot of? Women. I did meet many impressive young men, but I couldnâ€™t help but feel a little lost being one of the few girls there. I am aware of the general lack of women in STEM, and I want to help raise those numbers. I know there are many other intelligent women in the STEM field, and I want to find them. I want to talk to them about their experiences and their obstacles. I want to know how theyâ€™re making spaces for themselves in a world that doesnâ€™t always value us. As I navigate college and the professional world, the Sprinternship program would be an amazing opportunity to learn from and be inspired by powerful women. I also believe the Sprinternship would be a great opportunity to find a new community, network, solve important issues, and learn new things. Aside from that, I have some more personal goals. I believe this program will help me learn more about myself and what exactly I want from the tech field. I also want to work on being more vocal with my thoughts and opinions. My academic goals include strengthening my critical thinking and problem-solving skills. 
","I want to learn in this environment and community because I want to be surrounded by women who understand the struggles and challenges I face as a woman pursuing a tech career. It would be amazing to be a part of something where everyone knows what it's like. I want to learn from, befriend, and network with these people. I also want to share my knowledge and my stories with the people who are a part of this community. ",Yes,"Fairfax, VA (George Mason University Campus) or at home in PG County, maryland","Washington, DC,Maryland - Prince George's and Montgomery Counties,Virginia - Arlington and Fairfax Counties","I understand the time commitment of participating in a Sprinternship. If accepted into the program, I will not enroll if I am unable to fully participate.",Yes,Yes,US Citizen,,No,Yes,"I am actually not sure where I will be living during the time period of this internship, I do not yet know when we move back onto campus after winter break. Also, I really want to participate in this program because I am tired of being one of the few girls in my computer science class. I want to meet people who are like me.","Professor,Friend",,Nasrin Ali,Nasrin Ali,,,,,,
2021-10-05 00:07:06,2021-10-05 00:44:39,IP Address,100.36.167.173,100,2252,True,2021-10-05 00:44:40,R_12gr99m5z6u56ur,,,,,38.8173065185546875,-77.290496826171875,anonymous,EN,1,Khang,,Le,04/18/2002,khangnle362@gmail.com,G01254457,703-362-6342,5034 Glen Park Rd,,Annandale,VA,22003,Bachelor's,76-90 credits,2022-23 (Fall 2022 - Summer 2023),Yes,Computer Science,,,,No,3.700 to 4.00,5+,"Competition (hackathon, robotics),Student Organization",No,I currently have an interest in the collaborative environment that a software engineering position brings as well as the beneficial impact that projects in such a career can have. I also have an interest in pursuing machine learning and artificial intelligence in the future because I firmly believe in the future potential of the technology on all of society.,"I worked in a team with two other students to create a MIDI music editor in Java. We collaborate effectively through group messaging apps and contributed code through GitHub so that we could work asynchronously in response to the pandemic. I worked primarily on the graphical user interface for the music editor, and once my teammates had created the necessary tools to play notes, I integrated that functionality into the music sheet in the GUI. I also coordinated expectations and deadlines for my other teammates as I was reliant on their completion of certain aspects of the backend to effectively work with the GUI. 

Although I believe the project went well overall, I believe I should have used JavaFX to explore more unfamiliar territory and provide a cleaner GUI. I stuck to Java Swing because I feared time constraints and was somewhat more familiar with Swing. I believe creating a long-term timeline would have helped resolve my fears. I also believe having group meetings, while not necessary, would have potentially expedited or innovated our work by having us be in an environment where we could bounce ideas of off one another which is not as effective a strategy with asynchronous communication and programming.","I currently lack real world experience in the tech industry and wish to obtain that experience through the Sprinternship program. I want a chance to work with an employer in the tech industry so that I can explore the new technologies that these companies are working on and contribute meaningfully to these impactful technologies. I believe the Sprinternship will benefit my personal interest in becoming a more technologically knowledgeable individual, my academic understanding of unfamiliar computer science topics and fields, and my pursuit of a professional career in software development.","I want to contribute my part to the community by standing with those minority groups who are currently underrepresented in the tech industry. I also learn best by doing. By working in a position that resembles a real software development environment and working together with those underrepresented individuals, I believe I will be able to achieve a high amount of personal and professional growth.",Yes,"Annandale, VA","Washington, DC,Maryland - Prince George's and Montgomery Counties,Virginia - Arlington and Fairfax Counties","I understand the time commitment of participating in a Sprinternship. If accepted into the program, I will not enroll if I am unable to fully participate.",No,Yes,US Citizen,,No,Yes,,Break Through Tech,,Khang Le,Khang Le,,,,,,
2021-09-22 12:05:30,2021-10-05 09:12:51,IP Address,129.174.182.70,100,1112841,True,2021-10-05 09:12:52,R_27qhgpk8oGRQFGA,,,,,38.84759521484375,-77.32810211181640625,anonymous,EN,0.89999997615814208984375,"Tran ","Tran ",Tran,02/20/2001,ttran200@gmu.edu,G01197021,5716399630,4450 University Drive,,Fairfax,VA,22030,Bachelor's,61-75 credits,2022-23 (Fall 2022 - Summer 2023),Yes,Computer Science,,,,No,3.00 to 3.69,4,"Student Organization,Campus Event",No,The solution to real world problems that makes a difference in everyone's lives. I would also be able to use my skills to protect and connect others.,"The goal of my team was to present about definition of function and its applications at a high school math fair. In order to demonstrate when a graph expression is a function, our team decided to catch participants attention by making a function machine model. My role in the team was to present the definition of function and build the model. There would be different graph expressions on cards and participants had to solve to find whether the expression is a function or not and its output. After writing down the answers, the participants will insert the card and the machine will output the right answer immediately. Our idea for building the model caught people's eyes and we were able to convey the information smoothly and interestingly. Next time, I would communicate more with my teams on how to make real life model to get the participants see what if a real life function is not a function. It would help the participation see why it's important for function to behave correctly.","This Sprinternship program is a great opportunity for me to get my hand on real world experience in tech. I would be able to apply my skills and what I have learned to work with others in my field to obtain solutions to problems and challenges. This also would help leading me to what aspect in computer science I would want to concentrate on and teach me many great things that I wouldn't have known. Most importantly, I would have the chance to connect to many women in stem to build my network. Sprinternship would be the great opportunity for me in preparing for my professional career in tech.","Throughout all of my Computer Science classes, it's been mostly consisted of men and I haven't been able to connect or communicate with other women in my field. This environment and community would be a great chance for me to connect and build my network with other woman. Also, this collaborative environment would allow me to build my work experience by communicating and interacting with my colleagues for different projects and learn to improve my skills from them.",Yes,"Fairfax, Virginia",Virginia - Arlington and Fairfax Counties,"I understand the time commitment of participating in a Sprinternship. If accepted into the program, I will not enroll if I am unable to fully participate.",Yes,No,F1 or J1 Visa Holder,,No,Yes,"I came from a country where computer science is still a new field and there is a rare number of women in this field. None of them know about this field or think about pursuing a career in this field even though they might would have loved it. This field is known mostly for men so it has taken women in my country back from pursuing career in tech and I was one of them. I used to believe this was an intense field that only men could be able to do it. However, once I got my hand on this, I fell in love and knew how women would also be able to do great in tech as well as men. I wish to spread this to all the women who thinks of pursuing a career in tech.  ",Break Through Tech,,Tran Nguyen Nhu Tran,Tran Nguyen Nhu Tran,,,,,,
2021-10-04 18:03:44,2021-10-05 10:37:51,IP Address,129.174.182.108,100,59646,True,2021-10-05 10:37:52,R_2PvCSe3RbOszAIx,,,,,38.84759521484375,-77.32810211181640625,anonymous,EN,1,Likhitha,,Addagatla,01/26/2002,laddagat@gmu.edu,G01258908,5714098733,2508 William Taft Ct,,Herndon,VA,20171,Bachelor's,61-75 credits,2022-23 (Fall 2022 - Summer 2023),Yes,Cyber-Security,,,,Not sure,3.700 to 4.00,2,Student Organization,No," After being introduced to robotics and programming in 6th grade, I was passionate about pursuing a career in tech. At first, it was the excitement of building robots and making them move as I desired. This curiosity pushed me to continue pursuing STEM classes in middle school and high school. My high school experience was the most defining in broadening my view on STEM, eventually leading to me deciding to major in Cyber Security Engineering. I realized I had a lot of interests outside of STEM such as environmental sustainability, business, law and policy. I wanted to major in an area of STEM that allows for flexibility to pursue my different interests. Like computer science, cyber security allows me to apply my cyber knowledge to a variety of industries as the protection of our systems becomes more important each day. Masonâ€™s unique focus on the engineering aspect of cyber security was even more appealing because of my curiosity about how things work. Having the opportunity to get involved with companies that have similar interests as me and contributing by strengthening their systems so that they can focus on accomplishing the broader goals truly motivates me. ","Recently, I worked with two local companies called Bixal and CodeNinajs to host a collaborative networking event for the members of George Mason Universityâ€™s Girls Who Code (GWC) College Loop, an organization where I currently serve as vice president. I had the amazing opportunity to work with professionals from a variety of tech fields who also had the goal of providing more support to women entering the STEM field. Our goal as a team was to create an event in which members can get advice about their respective majors and career paths from other women who have been in their place. We did this by creating an event in which attendees can join different groups to interact with an expert in their field and ask any questions they might have. 
I was the main point of contact for Girls Who Code and focused on developing an event that students would be interested in based on my experiences. I reached out to the Society of Women Engineers to increase the scope of our event and reach more girls. I actively attended planning meetings, contributed a variety of ideas for the event itself, and maintained an open line of communication between GWC, Bixal, CodeNinjas, and the Society of Women Engineers. I was also involved with delegating tasks to GWC officers when it came to promoting the event. 
While I learned an immense amount about what goes into organizing and hosting a successful event, some skills I would personally like to work on is engaging more GWC officers- not only to share the hands-on experience with others but to also distribute the work more evenly. Additionally, I wish I was a bit more proactive in organizing some aspects of the event such as RSVP forms because I felt that it was rushed. This opportunity was an amazing learning experience for me and I loved getting to interact with a diverse group of individuals.","I would love the opportunity to participate in this Sprinternship to better prepare myself for entering a career in cyber security. A program like this allows me to focus on my personal goals of emotional independence and financial independence by allowing me to connect with other female-identifying students and gain more insight on how to do well in a field that tends to be dominated by males. I believe building a supportive community for females is extremely important, which is what Iâ€™m trying to do as a part of Girls Who Code. I would like to explore this further through this Sprinternship as I also focus on my academic goal to continue learning things that Iâ€™m passionate about. Learning to me goes beyond simply learning concepts on my own. I believe the exchange of ideas between individuals is an essential part of learning and the Sprintership program will allow me to share my experiences while hearing from others who have unique backgrounds. Lastly, I would like to improve my professional skills and one of the best ways to do this is through career development, which this program emphasizes. If Iâ€™m given this opportunity, I would not only focus on expanding my professional network, but I would also seek to get professional advice and suggestions on things such as resumes and interview skills. ","As a junior, Iâ€™m looking for opportunities that will allow me to move closer to my academic, professional, and personal goals. Because of that, this programâ€™s focus on creating a safe and inclusive environment in which I can work towards these goals excited me. Additionally, I love engaging with people from different backgrounds. One of my favorite things about Mason is that I have had the opportunity to work with people who have unique experiences. After working on a project in my Art and Protest class in which I got to work with people of different majors, I realized diversity is something I would love to have in my career and the programs I get involved with. Although attendees of this Sprinternship are pursuing a career in tech, the chance of working closely with and meeting like-minded, yet diverse females excites me.",Yes,"Herndon, VA","Washington, DC,Virginia - Arlington and Fairfax Counties","I understand the time commitment of participating in a Sprinternship. If accepted into the program, I will not enroll if I am unable to fully participate.",No,Yes,Permanent Resident,,No,Yes,,Other,Honors College Newsletter,Likhitha Addagatla,Likhitha Addagatla,,,,,,
2021-10-05 10:21:18,2021-10-05 11:36:40,IP Address,129.174.182.8,100,4521,True,2021-10-05 11:36:40,R_3mmdImdBN3ghVcQ,,,,,38.84759521484375,-77.32810211181640625,anonymous,EN,0.89999997615814208984375,Brandon,Brandon,Tran,03/28/2002,brandon.tran2726@gmail.com,G01188855,7033429571,6039 Vista Dr,,Falls Church,VA,22041,Bachelor's,31-45 credits,2023-24 (Fall 2023 - Summer 2024),Yes,Computer Science,,,,Not sure,3.700 to 4.00,4,I have not participated in any activities related to computer science before.,No,"The thing that interests and excites me about pursuing a career in tech is having the opportunity to create and help enhance current tools in the tech industry. By doing so I would not only be able to help the greater community but assist others in my field at completing their objectives and benefitting society as well. Specific areas of interest for me would be cybersecurity, artificial intelligence, and ethics and compliance in programming and data collection and usage.","An event that describes when I have worked well in a team would have to be when I am working during my shift every Thursday and Friday. Working at a boba shop, there is usually a rush that requires me and my coworkers to quickly make and hand out the drinks. To make sure the drinks are made in a timely manner we usually split up our roles and pass the drinks down the line. My role was to add the correct toppings to each drink and hand it to my coworker who would put ice in the cup and fill it with the selected drink. Though this may seem like a simple display of teamwork if anywhere in this chain me or my coworker's messed up, we would have to remake the drink which would mess up the flow and have customers wait longer for their drink.","My personal, academic, and professional goals for the Sprinternship program are to expand my professional network while learning and gaining valuable work experience in my field of study (computer science). Having little to no work/internship experience in my field of study, I believe the Sprinternship program would be an excellent opportunity to put what I have learned and my skills to the test and figure out where I excel and areas I need to improve on. At the same time, I would also be able to receive input from people who have experience in the field and could teach me much more than I already learn in my classes. The opportunity to meet other people who are interested in tech and people who work in tech is also a major reason why I applied as meeting new people can help me learn new things and build long-lasting relationships.","In learning to become a programmer an important skill to have is to be mindful of one's own biases and being open-minded to new ideas. By learning in the environment and community fostered by the Sprinternship program I would be able to meet many different people with their own unique backgrounds and stories. The reason I would want to learn in this sort of community is because of the vast amount of different perspectives that could challenge my own and help me grow not only as a programmer but as a person. In addition to this, I would also be able to contribute to this diversity by sharing my own experiences as well.",Yes,"Falls Church, VA","Washington, DC,Virginia - Arlington and Fairfax Counties","I understand the time commitment of participating in a Sprinternship. If accepted into the program, I will not enroll if I am unable to fully participate.",No,Yes,US Citizen,,No,Yes,,Professor,,Brandon Tran,Brandon Tran,,,,,,
